"OCQ260.Code.or.Value","OCQ260.Value.Description","OCQ260.Count","OCQ260.Cumulative","OCQ260.Skip.to.Item"
"1","An employee of a private company, business, or individual for wages, salary, or commission.",2239,2239,NA
"2","A federal government employee",115,2354,NA
"3","A state government employee",191,2545,NA
"4","A local government employee",176,2721,NA
"5","Self-employed in own business, professional practice or farm.",325,3046,NA
"6","Working without pay in family business or farm",14,3060,NA
"77","Refused",7,3067,NA
"99","Don't know",20,3087,NA
".","Missing",3088,6175,NA
