"OHX10SE.Code.or.Value","OHX10SE.Value.Description","OHX10SE.Count","OHX10SE.Cumulative","OHX10SE.Skip.to.Item"
"0","Sealant not present",4226,4226,NA
"1","Occlusal sealant on permanent tooth",0,4226,NA
"2","Facial sealant on permanent tooth",0,4226,NA
"3","Lingual sealant on permanent tooth",6,4232,NA
"4","Occlusal sealant on primary tooth",0,4232,NA
"9","Cannot be assessed",1396,5628,NA
"12","Occlusal sealant and facial sealant on permanent tooth",0,5628,NA
"13","Occlusal sealant and lingual sealant on permanent tooth",0,5628,NA
"< blank >","Missing",3970,9598,NA
