"OHX18CTC.Code.or.Value","OHX18CTC.Value.Description","OHX18CTC.Count","OHX18CTC.Cumulative","OHX18CTC.Skip.to.Item"
"E","Missing due to dental disease",808,808,NA
"M","Missing due to other causes",5,813,NA
"R","Missing due to dental disease but replaced",658,1471,NA
"S","Sound permanent tooth",2795,4266,NA
"U","Unerupted",1637,5903,NA
"X","Missing due to other causes but replaced",6,5909,NA
"Y","Tooth present, condition cannot be assessed",4,5913,NA
"Z","Permanent tooth with surface condition (s)",2129,8042,NA
"< blank >","Missing",545,8587,NA
