"OHX23ESL.Code.or.Value","OHX23ESL.Value.Description","OHX23ESL.Count","OHX23ESL.Cumulative","OHX23ESL.Skip.to.Item"
"0","Sound; Any wear restricted to enamel only",5336,5336,NA
"1","Loss of enamel just exposing dentin",54,5390,NA
"2","Loss of enamel and extensive loss of dentin (see notes for surface details for scoring)",11,5401,NA
"3","Complete loss of enamel on a surface; pulp exposure or exposure of secondary dentin where pulp used",2,5403,NA
"8","Loss due to trauma and not wear",4,5407,NA
"9","Could not assess",360,5767,NA
".","Missing",951,6718,NA
