"OHX08TR.Code.or.Value","OHX08TR.Value.Description","OHX08TR.Count","OHX08TR.Cumulative","OHX08TR.Skip.to.Item"
"0","No evidence of traumatic injury",3425,3425,NA
"1","Unrestored enamel fracture present that does not involve the dentine",186,3611,NA
"2","Unrestored enamel fracture which involves the dentine",23,3634,NA
"3","Untreated damage (indicative of pulpal involvement)",8,3642,NA
"4","Fracture restored, either with full crown or less extensive restoration",87,3729,NA
"5","Lingual restoration as a sign of endontic therapy, and a positive history of root",11,3740,NA
"6","Tooth is missing due to trauma",6,3746,NA
"9","Cannot be assessed",169,3915,NA
".","Missing",4932,8847,NA
